finding,pubmed_id,finding_id
"The Taiwan national programme significantly reduced cervical cancer risk, with a 47.8% decrease in invasive cancer incidence during 1995-2006.",PMC2713714,PMC2713714_0
"The incidence of carcinoma in situ increased rapidly after 1995, but decreased in most age groups except for women aged 30-39 years.",PMC2713714,PMC2713714_1
"The reduction in invasive cancer incidence was observed in all age groups, with a 48.0% decrease during 1995-2006.",PMC2713714,PMC2713714_2
The incidence of invasive cancer and carcinoma in situ rapidly reduced in 2003 and rebounded in 2004 due to a reduction in screening and confirmatory diagnosis of cervical cancers because of the outbreak of severe acute respiratory syndrome in 2003 in Taiwan.,PMC2713714,PMC2713714_3
"The incidence of cervical adenocarcinoma increased for several years after the screening programme was implemented in Taiwan, but then reduced slightly.",PMC2713714,PMC2713714_4
