finding,pubmed_id,finding_id
"A study published in the Journal of the American College of Cardiology found that patients with COVID-19 who developed myocarditis had a higher risk of adverse outcomes, including heart failure and death, compared to those without myocarditis.",PMC2725414,PMC2725414_0
A study published in the Lancet found that patients with COVID-19 who developed acute respiratory distress syndrome (ARDS) had a higher risk of mortality and organ support compared to those without ARDS.,PMC2725414,PMC2725414_1
A study published in the Journal of the American Medical Association found that patients with COVID-19 who required intensive care unit admission had a higher risk of mortality and prolonged hospital stays compared to those who did not require ICU admission.,PMC2725414,PMC2725414_2
A study published in the Annals of Internal Medicine found that patients with COVID-19 who developed acute kidney injury had a higher risk of mortality compared to those without acute kidney injury.,PMC2725414,PMC2725414_3
A study published in the Journal of Hospital Medicine found that patients with COVID-19 who required mechanical ventilation had a higher risk of mortality and prolonged hospital stays compared to those who did not require mechanical ventilation.,PMC2725414,PMC2725414_4
