finding,pubmed_id,finding_id
"The study found that viral load was high in the febrile period and in patients with pneumonia, with children under the age of 13 years having a significantly longer viral shedding period than older children, even after oseltamivir therapy.",PMC3298297,PMC3298297_0
"The study demonstrated that the duration of viral shedding in pandemic (H1N1) 2009 infection was notably longer in children under the age of 13 years than in older children, even after oseltamivir therapy.",PMC3298297,PMC3298297_1
"The study indicated that younger children (under the age of 13 years) may require a longer isolation period than older children, even after oseltamivir therapy.",PMC3298297,PMC3298297_2
The study suggested that patients with pneumonia may require more aggressive treatment for infection with pandemic (H1N1) 2009 virus.,PMC3298297,PMC3298297_3
"The study highlighted that children under the age of 13 years had a significantly longer viral shedding period than older children, even after oseltamivir therapy, which may have implications for the length of isolation required.",PMC3298297,PMC3298297_4
