finding,pubmed_id,finding_id
"During the study period in Brazil's southern region, infections with both pandemic H1N1 influenza virus and seasonal respiratory viruses were observed, suggesting a lack of viral strain displacement or viral interference.",PMC3122811,PMC3122811_0
"Patients infected with pandemic H1N1 influenza virus were predominantly young adults, while patients infected with seasonal respiratory viruses were primarily elderly and children.",PMC3122811,PMC3122811_1
"Viral and bacterial coinfections were not common in patients infected with pandemic H1N1 influenza virus, and secondary bacterial pneumonia was not observed in these patients.",PMC3122811,PMC3122811_2
"Factors associated with a severe outcome, such as obesity, underlying diseases, and pregnancy, were prognostic of a worse clinical outcome in both groups of infected patients (crV and pandemic H1N1 influenza virus).",PMC3122811,PMC3122811_3
"Patients infected with pandemic H1N1 influenza virus had a higher mortality rate than those infected with crVs, and the mortality rate associated with pandemic H1N1 influenza virus infection in Brazil's southern region was higher than that observed in other countries in the Americas during the same period.",PMC3122811,PMC3122811_4
