finding,pubmed_id,finding_id
"The study describes the successful establishment and application of a real-time loop-mediated isothermal amplification system for the detection of CYP2C19 polymorphisms, which is a rapid, feasible, and cost-effective point-of-care nucleic acid amplification technology.",PMC4887897,PMC4887897_0
"The study demonstrates the high sensitivity and accuracy of the rt-lamp method for detection of human genomic DNA, as evidenced by its ability to quantitatively detect trace amounts of target dna sequences in a single step, as well as its high specificity and efficiency in suppressing non-specific amplification.",PMC4887897,PMC4887897_1
"The study presents a new rt-lamp protocol for the detection of CYP2C19 SNPs, which is optimized for real-time fluorescence detection and is applicable to a variety of dna targets.",PMC4887897,PMC4887897_2
"The study highlights the feasibility and clinical applicability of rt-lamp in detecting polymorphisms in human genomic DNA, as demonstrated by its successful application to 100 peripheral blood samples, as well as its ability to detect trace amounts of target dna sequences in a single step.",PMC4887897,PMC4887897_3
"The study provides a new rt-lamp protocol for the detection of CYP2C19 polymorphisms, which is optimized for real-time fluorescence detection and is applicable to a variety of dna targets, while also presenting a new rt-lamp reaction system with a high specificity and efficiency in suppressing non-specific amplification.",PMC4887897,PMC4887897_4
