finding,pubmed_id,finding_id
"Dengue fever is prevalent in clinically suspected cases presenting during September through November in non-endemic areas, with a laboratory incidence of 30.68%.",PMC4260275,PMC4260275_0
"Dengue fever primarily affects adult males, with chills, fever, and myalgia as the most common presenting symptoms.",PMC4260275,PMC4260275_1
Dengue fever patients presenting during the early phase of the disease (≤5 days) have higher sensitivity in detecting the ns1 antigen compared to those with a disease duration of 7 days or more.,PMC4260275,PMC4260275_2
"Dengue fever patients presenting with hepatomegaly, splenomegaly, and lymphadenopathy are commonly observed, with thrombocytopenia and leucopenia as significant laboratory findings.",PMC4260275,PMC4260275_3
"Dengue fever patients presenting with a longer duration of fever (>5 days) may have hemorrhagic manifestations, hepatomegaly, impaired liver function, and thrombocytopenia, with or without impairment of other hematological parameters, indicating a possible case of dengue hemorrhagic fever or dengue shock syndrome.",PMC4260275,PMC4260275_4
