finding,pubmed_id,finding_id
"Human bocavirus (HBV) is a newly discovered parvovirus associated with respiratory tract infections, particularly in children.",PMC4833746,PMC4833746_0
"HBV1 is the most prevalent genotype, accounting for 90% of HBV infections in Iranian children.",PMC4833746,PMC4833746_1
"HBV infection is common, with a prevalence rate of 10.7% in young children with respiratory tract infections in Iran.",PMC4833746,PMC4833746_2
"HBV infection is associated with a high rate of co-infections, particularly with respiratory syncytial virus (RSV).",PMC4833746,PMC4833746_3
"HBV plays a significant role in respiratory tract infections in young children, suggesting its importance as a causative pathogen.",PMC4833746,PMC4833746_4
