finding,pubmed_id,finding_id
"In a prospective case-control study in Mali, the most common causes of community-acquired pneumonia in children were Streptococcus pneumoniae, respiratory syncytial virus, human metapneumovirus, and influenza A virus.",PMC4687909,PMC4687909_0
"The study found that viral pneumonia, including infection with respiratory syncytial virus, human metapneumovirus, and influenza A virus, is a major segment of the pneumonia burden in Mali.",PMC4687909,PMC4687909_1
"The study also observed that Streptococcus pneumoniae, human metapneumovirus, and influenza A virus were detected in almost 25% of children with community-acquired pneumonia, but the detection rate was not significantly different from that in children without pneumonia.",PMC4687909,PMC4687909_2
"The study found that the prevalence of carriage in asymptomatic children is an important consideration when interpreting positive nasal swabs, as at the individual level, it can be difficult to establish whether a positive swab denotes etiology or nasopharyngeal colonization.",PMC4687909,PMC4687909_3
"The study highlighted the importance of centralized microbiological analysis, as carried out in the Emerging Pathogens Laboratory in Lyon, France, as it enhanced data quality in the study.",PMC4687909,PMC4687909_4
