finding,pubmed_id,finding_id
"The global burden of acute febrile illness (AFI) is estimated to be over 2 billion cases and 2 million deaths annually, with zoonotic and emerging infectious diseases most known (EID) responsible for an estimated >2 billion AFI cases and 2 million deaths annually (34,35).",PMC5711315,PMC5711315_0
"In response to EID, many countries are undertaking efforts to identify and prioritize EID of greatest national concern through a one health approach (i.e., linking human, environmental, and animal health) (37).",PMC5711315,PMC5711315_1
"Since 2001, CDC has worked with Mérieux-Novartis (Mérieux-Novartis) to develop and administer meningococcal vaccines to millions of people living in the African meningitis belt and leads the Meningitis Vaccine Project (MVP) to enhance surveillance to monitor the effectiveness of vaccines and emergence of new meningococcal strains (33).",PMC5711315,PMC5711315_2
"In response to the West Africa Ebola epidemic, CDC provided technical and financial support to develop infection control and antimicrobial drug resistance capacity in low- and middle-income countries through the Stop Transmission of Polio (STOP) program of the Global Polio Eradication Initiative (39).",PMC5711315,PMC5711315_3
"During February–July 2003, SARS spread across 4 continents, infected 8,100 persons, killed 774 persons, and cost the global economy $40 billion (46).",PMC5711315,PMC5711315_4
