finding,pubmed_id,finding_id
"A substantial proportion of acute respiratory infections (ARIs) in North China is associated with respiratory viruses, particularly RSV in children under 2 years old, Adenoviruses in children 15-34 years old and adults, and co-infection of RSV and IFVs in children (table s2).",PMC5806372,PMC5806372_0
"In hospitalized children, RSV, Adenoviruses, and co-infection of RSV and IFVs are more frequent, indicating potential severity of ARIs (findings from figure s1).",PMC5806372,PMC5806372_1
"In outpatient/ED patients, IFVs are the most common virus across all age groups (table s2).",PMC5806372,PMC5806372_2
"After controlling for other viruses and covariates, Adenoviruses and RSV are independently associated with increased hospitalization in children, as well as Adenoviruses in adults (adjusted odds ratio: 3.97, 2.14) (conclusions).",PMC5806372,PMC5806372_3
"Attending clinicians should be more vigilant of respiratory viruses, particularly RSV, Adenoviruses, and co-infection of RSV and IFVs, in North China (conclusions).",PMC5806372,PMC5806372_4
