finding,pubmed_id,finding_id
"In Saudi Arabia between April 2014 and June 2016, the mortality rate for Middle East Respiratory Syndrome Coronavirus (MERS-CoV) infection was 20% among the 281 confirmed cases.",PMC6518603,PMC6518603_0
"Male patients had a higher mortality rate than female patients, with a male-to-female ratio of 1.45:1.",PMC6518603,PMC6518603_1
Elderly patients (>61 years) had a significantly higher mortality rate than non-elderly patients.,PMC6518603,PMC6518603_2
"Comorbidities such as diabetes mellitus, hypertension, ischemic heart disease, congestive heart failure, end-stage renal disease, and chronic kidney disease significantly influenced the severity of MERS-CoV infection, with a higher mortality rate observed in patients with these comorbidities.",PMC6518603,PMC6518603_3
Sob and respiratory failure were significantly associated with higher mortality in MERS-CoV patients.,PMC6518603,PMC6518603_4
