finding,pubmed_id,finding_id
"Six randomized, placebo-controlled trials involving 523 children aged 6-10 years with non-β-hemolytic streptococcal tonsillopharyngitis or acute bronchitis were analyzed.",PMC6477747,PMC6477747_0
Eps 7630 (Pelargonium sidoides extract) reduced the cumulative dose of paracetamol by an average of 244mg compared to placebo in 5 out of 6 trials.,PMC6477747,PMC6477747_1
"At treatment end, 30.2% of children who received eps 7630 were still unable to attend school, compared to 74.4% of children who received placebo.",PMC6477747,PMC6477747_2
"In children with acute respiratory tract disorders during infancy, eps 7630 alleviated symptom burden and accelerated recovery, despite having no known antipyretic effect.",PMC6477747,PMC6477747_3
"Concomitant use of paracetamol was reduced in children who received eps 7630, even though it is commonly used to improve comfort in children with acute respiratory tract disorders.",PMC6477747,PMC6477747_4
