finding,pubmed_id,finding_id
"Traditional Chinese Medicine (TCM) has been widely used in China for over 2000 years to manage various diseases, including diabetes and its complications.",PMC6488948,PMC6488948_0
"Tangminling pill, a TCM preparation, has been found to be effective and safe for glycemic control and β-cell function in type 2 diabetes mellitus (T2DM) patients.",PMC6488948,PMC6488948_1
"The underlying mechanisms of the beneficial effects of Tangminling pill may involve the anti-inflammatory, anti-oxidative, and anti-hyperglycemic actions of its major herbal components, such as berberine, wogonin, baicalin, and flavanones.",PMC6488948,PMC6488948_2
"Tangminling pill may also improve insulin sensitivity and prevent hypoglycemia, without increasing the risk of adverse events.",PMC6488948,PMC6488948_3
"However, more high-quality studies with larger sample sizes and longer intervention durations are needed to further investigate the impacts of Tangminling pill on diabetes and diabetic complications.",PMC6488948,PMC6488948_4
