finding,pubmed_id,finding_id
"Preprints, a form of information sharing during disease epidemics, have been formally recognized by numerous funders and publishers of scientific research.",PMC6518571,PMC6518571_0
"During the Zika virus outbreak in the Americas, five out of 16 studies highlighted by Kraemer et al. published their findings as preprints, accelerating availability by 111-222 days.",PMC6518571,PMC6518571_1
"Three out of eight studies during the Ebola virus disease outbreak in West Africa and one out of four studies during the Middle East Respiratory Syndrome (MERS) outbreak published their findings in Plos Currents Outbreaks, a now-defunct outlet known for expeditious publication during disease epidemics.",PMC6518571,PMC6518571_2
"Three types of findings (geographic origin, geographic spread, number of cases) were reported relatively close to one another during fairly early stages of three epidemics (Zika, Ebola, MERS).",PMC6518571,PMC6518571_3
"The integrated analyses advocated by Kraemer et al. struggle the most with timely publication, with a lag of at least 10 months behind all three other analysis types.",PMC6518571,PMC6518571_4
