finding,pubmed_id,finding_id
A 70-year-old woman with a history of hypothyroidism and pemphigus presented with non-productive cough and crackles on auscultation. Lab tests revealed mild lymphocytopenia and diffuse ground glass opacities with superimposed interlobular thickening (crazy paving pattern) on chest X-ray and CT.,PMC6308371,PMC6308371_0
"After 15 days, the patient developed acute respiratory failure and multiple enlarged lymph nodes, leading to a chest CT revealing bilateral infiltrations, diffuse ground glass opacities, and pleural effusion.",PMC6308371,PMC6308371_1
A surgical biopsy revealed peripheral T-cell lymphoma not otherwise specified (PTCL-NOS) with high proliferative index and EBV positivity.,PMC6308371,PMC6308371_2
"The patient exhibited progressive respiratory deterioration with lung involvement, leading to a diagnosis of PTCL with extranodal involvement of the lung parenchyma.",PMC6308371,PMC6308371_3
"The differential diagnosis for the initial crazy paving pattern included infection, heart failure, and lung involvement of PTCL, which was confirmed by CT-guided trans-thoracic lung biopsy.",PMC6308371,PMC6308371_4
