finding,pubmed_id,finding_id
"Thyme essential oil has high antibacterial activity against Streptococcus mutans, with a minimum inhibitory concentration (MIC) of 0.04 mg/ml in broth macrodilution tests.",PMC6064118,PMC6064118_0
"Cinnamon bark and clove oils also showed high inhibition against Streptococcus pneumoniae and Streptococcus pyogenes, respectively, with MIC values of 0.06 mg/ml and 0.1 mg/ml.",PMC6064118,PMC6064118_1
"Moraxella catarrhalis is the most sensitive to thyme essential oil, with an MIC of 0.09 mg/ml.",PMC6064118,PMC6064118_2
"Cinnamon bark essential oil is the most effective oil against Haemophilus spp., with an MIC of 0.06 mg/ml.",PMC6064118,PMC6064118_3
"In vapor phase tests, cinnamon bark essential oil showed the most effective antibacterial activity against all investigated pathogens, with MIC values ranging from 15.62-90 µl/l.",PMC6064118,PMC6064118_4
Eucalyptus and Scots pine essential oils showed weak antibacterial activity against the test bacteria in both test systems.,PMC6064118,PMC6064118_5
"(Optional finding) The combination of essential oils and antibiotics may be beneficial in the alternative treatment of respiratory tract diseases, but further in vivo studies are necessary to determine their effective dose, possible side effects, and toxicity.",PMC6064118,PMC6064118_6
